{
    "apiVersion":  1,
    "id":  "es-malaga",
    "countryCode":  "ES",
    "name":  "MÃ¡laga",
    "region":  "AndalucÃ­a",
    "timezone":  "Europe/Madrid",
    "center":  [
                   -4.4214,
                   36.7213
               ],
    "bounds":  [
                   [
                       -4.74,
                       36.49
                   ],
                   [
                       -4.15,
                       36.88
                   ]
               ],
    "modes":  [
                  "bus",
                  "rail"
              ],
    "presentation":  {
                         "title":  "Transit 3D",
                         "mapLabel":  "Mapa de transporte de MÃ¡laga",
                         "searchLabel":  "Buscar transporte en MÃ¡laga",
                         "initialZoom":  10.8,
                         "brandMark":  "t."
                     },
    "providers":  [
                      {
                          "id":  "emt-malaga",
                          "name":  "EMT MÃ¡laga",
                          "color":  "#00587C",
                          "primary":  true,
                          "sources":  {
                                          "gtfs":  "https://datosabiertos.malaga.eu/recursos/transporte/EMT/lineasYHorarios/google_transit_txt.zip"
                                      }
                      },
                      {
                          "id":  "metro-malaga",
                          "name":  "Metro de MÃ¡laga",
                          "color":  "#DC241F",
                          "primary":  true,
                          "sources":  {
                                          "gtfs":  "https://metromalaga.es/GTFS/GTFS_METRO_MALAGA.zip"
                                      }
                      },
                      {
                          "id":  "renfe-cercanias-malaga-c2",
                          "name":  "Renfe CercanÃ­as MÃ¡laga â€” C2",
                          "color":  "#0FCF34",
                          "primary":  true,
                          "sources":  {
                                          "gtfs":  "https://ssl.renfe.com/ftransit/Fichero_CER_FOMENTO/fomento_transit.zip"
                                      },
                          "routeIds":  [
                                           "32T0003C2",
                                           "32T0004C2"
                                       ]
                      },
                      {
                          "id":  "ctmam-bus",
                          "name":  "Consorcio de Transporte Metropolitano del Ãrea de MÃ¡laga",
                          "color":  "#009A44",
                          "group":  "Autobuses metropolitanos",
                          "sources":  {
                                          "gtfs":  "https://api.ctan.es/v1/datos/UNIFICADO/gtfs.zip"
                                      },
                          "routeIds":  [
                                           "4_1",
                                           "4_3",
                                           "4_4",
                                           "4_5",
                                           "4_7",
                                           "4_8",
                                           "4_9",
                                           "4_10",
                                           "4_11",
                                           "4_12",
                                           "4_13",
                                           "4_14",
                                           "4_15",
                                           "4_16",
                                           "4_17",
                                           "4_18",
                                           "4_19",
                                           "4_20",
                                           "4_89",
                                           "4_90",
                                           "4_93",
                                           "4_109",
                                           "4_110",
                                           "4_122",
                                           "4_123",
                                           "4_130",
                                           "4_133",
                                           "4_140",
                                           "4_208",
                                           "4_214",
                                           "4_215",
                                           "4_216",
                                           "4_217",
                                           "4_219",
                                           "4_226",
                                           "4_227",
                                           "4_230",
                                           "4_231",
                                           "4_234",
                                           "4_238",
                                           "4_239",
                                           "4_242",
                                           "4_254",
                                           "4_276",
                                           "4_279",
                                           "4_296",
                                           "4_297",
                                           "4_301",
                                           "4_302",
                                           "4_308"
                                       ]
                      }
                  ]
}